{"$schema":"https://json-schema.org/draft/2020-12/schema","$id":"live2d-tool-manifest/v1","type":"object","required":["schema","model","probe","run"],"properties":{"schema":{"const":"live2d-tool-manifest/v1"},"model":{"type":"object","required":["model3Json","expectedParameterCount"],"properties":{"model3Json":{"type":"string"},"expectedParameterCount":{"type":"integer","minimum":1}},"additionalProperties":true},"probe":{"type":"object","required":["executable"],"properties":{"executable":{"type":"string"},"args":{"type":"array","items":{"type":"string"}}},"additionalProperties":true},"run":{"type":"object","required":["outputRoot"],"properties":{"outputRoot":{"type":"string"},"writerMode":{"enum":["frozen","physics"]},"timeoutMs":{"type":"integer","minimum":1}},"additionalProperties":true},"experiment":{"type":"object","required":["type","parameterIds"],"properties":{"type":{"enum":["combination","sequence","ablation"]},"parameterIds":{"type":"array","minItems":2,"items":{"type":"string"}},"rangeScale":{"type":"number","exclusiveMinimum":0,"maximum":1},"wristScale":{"type":"number","exclusiveMinimum":0,"maximum":1},"steps":{"type":"integer","minimum":2},"repeats":{"type":"integer","minimum":1}},"additionalProperties":false},"roi":{"type":"object","additionalProperties":{"type":"object","required":["x","y","width","height"],"properties":{"x":{"type":"number","minimum":0,"maximum":1},"y":{"type":"number","minimum":0,"maximum":1},"width":{"type":"number","exclusiveMinimum":0,"maximum":1},"height":{"type":"number","exclusiveMinimum":0,"maximum":1}},"additionalProperties":false}},"review":{"type":"object","properties":{"provider":{"type":"string"},"batchSize":{"type":"integer","minimum":1},"timeoutMs":{"type":"integer","minimum":1}},"additionalProperties":true}},"additionalProperties":false}